[
  {
    "id": "zharenyy-ris-po-aziatski-vok",
    "title": "Жареный рис по-азиатски (эгг фрайд райс)",
    "source_type": "article",
    "source_url": "https://sol-chef.ru",
    "source_name": "Личный повар",
    "tags": [
      "вок",
      "рис",
      "азия",
      "быстрое"
    ],
    "category": "крупы",
    "summary": "Классика вока: холодный вчерашний рис, обжарка компонентов по отдельности на сильном огне и сборка в самом конце. Ключевая деталь — рис обязательно холодный и сухой, тёплый парит вместо жарки и превращается в кашу.",
    "ingredients": [
      "рис жасмин отварной, холодный, желательно со вчерашнего дня — 3–4 порции",
      "морковь 1 шт, мелким кубиком",
      "кукуруза консервированная или замороженная — горсть",
      "зелёный горошек замороженный — горсть",
      "ветчина, колбаса или остатки мяса — 100–150 г, кубиком",
      "зелёный лук — 3–4 стебля, белая и зелёная части отдельно",
      "яйцо 2 шт",
      "растительное масло",
      "сахар 1/2 ч. л.",
      "светлый соевый соус",
      "глутамат натрия — щепотка, по желанию"
    ],
    "steps": [
      "Разогреть вок или глубокую сковороду на сильном огне, влить немного масла.",
      "Обжарить морковь 1–2 минуты, добавить кукурузу, через минуту — горошек. Переложить всё на тарелку.",
      "Добавить ещё масла, подрумянить ветчину, добавить белую часть зелёного лука. Выложить к овощам.",
      "На раскалённом масле быстро обжарить яйцо до состояния мягкого скрэмбла, переложить отдельно.",
      "Разогреть масло, высыпать холодный сухой рис, разбивая комки лопаткой.",
      "Вернуть в вок овощи, мясо и яйцо, одновременно измельчая яйцо лопаткой при перемешивании.",
      "Приправить сахаром, влить соевый соус по краям сковороды (он слегка карамелизуется о раскалённый металл), добавить щепотку глутамата и зелёную часть лука.",
      "Тщательно перемешать и подавать сразу."
    ],
    "notes": "Холодный рис — не прихоть: крахмал на поверхности зёрен за ночь в холодильнике подсыхает, зёрна разделяются при жарке, а не слипаются в комок, как случилось бы со свежесваренным тёплым рисом. Соус лучше лить по краям сковороды, а не прямо на рис — контакт с раскалённым металлом на секунду карамелизует соевый соус и даёт лёгкий дымный аромат вместо просто солёного вкуса.",
    "added": "2026-07-22"
  }
]
